{
  "subject": {
    "code": "AP_LATIN",
    "name": "AP Latin",
    "examMode": "HYBRID_DIGITAL"
  },
  "totalDurationMinutes": 175,
  "sections": [
    {
      "id": "I",
      "name": "Section I: Multiple Choice",
      "type": "MCQ",
      "questionCount": 50,
      "durationMinutes": 70,
      "weightPercent": 50,
      "calculatorAllowed": false,
      "subParts": []
    },
    {
      "id": "II",
      "name": "Section II: Free Response",
      "type": "FRQ",
      "questionCount": 5,
      "durationMinutes": 105,
      "weightPercent": 50,
      "calculatorAllowed": false,
      "subParts": [
        { "id": "II-1", "name": "Translation (Vergil)", "questionCount": 1, "durationMinutes": 15 },
        { "id": "II-2", "name": "Translation (Caesar)", "questionCount": 1, "durationMinutes": 15 },
        { "id": "II-3", "name": "Analytical Essay", "questionCount": 1, "durationMinutes": 40 },
        { "id": "II-4", "name": "Short Answer: Latin Explication", "questionCount": 1, "durationMinutes": 15 },
        { "id": "II-5", "name": "Short Answer: Scansion or Context", "questionCount": 1, "durationMinutes": 20 }
      ]
    }
  ],
  "unitWeights": [
    { "unit": 1, "title": "Vergil: Aeneid (Books 1, 2, 4, 6)", "weightPercent": { "min": 40, "max": 50 } },
    { "unit": 2, "title": "Caesar: Gallic War (Books 1, 4, 5, 6)", "weightPercent": { "min": 40, "max": 50 } },
    { "unit": 3, "title": "Sight Reading and Latin Grammar", "weightPercent": { "min": 5, "max": 10 } }
  ],
  "scoringNotes": "MCQ scored by machine. FRQ scored by readers; translations scored on accuracy, analytical essay on a 6-point rubric, short answers worth 4-6 points each. Section I is 50% and Section II is 50% of the total score.",
  "specialPolicies": {
    "calculatorPolicy": "No calculator allowed.",
    "referenceSheet": false,
    "deliveryNotes": "Section I completed digitally via Bluebook app. Section II (FRQ) completed on paper. A Latin dictionary is not provided; students must rely on vocabulary knowledge."
  }
}
