{
  "subject": {
    "code": "AP_MICRO",
    "name": "AP Microeconomics",
    "examMode": "HYBRID_DIGITAL"
  },
  "totalDurationMinutes": 130,
  "sections": [
    {
      "id": "I",
      "name": "Section I: Multiple Choice",
      "type": "MCQ",
      "questionCount": 60,
      "durationMinutes": 70,
      "weightPercent": 66.7,
      "calculatorAllowed": false,
      "subParts": []
    },
    {
      "id": "II",
      "name": "Section II: Free Response",
      "type": "FRQ",
      "questionCount": 3,
      "durationMinutes": 60,
      "weightPercent": 33.3,
      "calculatorAllowed": false,
      "subParts": [
        { "id": "II-Long", "name": "Long FRQ", "questionCount": 1, "durationMinutes": 25 },
        { "id": "II-Short", "name": "Short FRQs", "questionCount": 2, "durationMinutes": 35 }
      ]
    }
  ],
  "unitWeights": [
    { "unit": 1, "title": "Basic Economic Concepts", "weightPercent": { "min": 5, "max": 10 } },
    { "unit": 2, "title": "Supply and Demand", "weightPercent": { "min": 15, "max": 22 } },
    { "unit": 3, "title": "Production, Costs, and the Perfect Competition Model", "weightPercent": { "min": 22, "max": 32 } },
    { "unit": 4, "title": "Imperfect Competition", "weightPercent": { "min": 15, "max": 22 } },
    { "unit": 5, "title": "Factor Markets", "weightPercent": { "min": 10, "max": 15 } },
    { "unit": 6, "title": "Market Failure and the Role of Government", "weightPercent": { "min": 12, "max": 18 } }
  ],
  "scoringNotes": "MCQ scored by machine. FRQ scored by readers; long FRQ worth 10 points, short FRQs worth 5 points each. Section I is 66.7% and Section II is 33.3% of the total score.",
  "specialPolicies": {
    "calculatorPolicy": "No calculator allowed.",
    "referenceSheet": false,
    "deliveryNotes": "Section I completed digitally via Bluebook app. Section II (FRQ) completed on paper."
  }
}
