{
  "subject": {
    "code": "AP_MACRO",
    "name": "AP Macroeconomics",
    "examMode": "HYBRID_DIGITAL"
  },
  "totalDurationMinutes": 130,
  "sections": [
    {
      "id": "I",
      "name": "Section I: Multiple Choice",
      "type": "MCQ",
      "questionCount": 60,
      "durationMinutes": 70,
      "weightPercent": 66.7,
      "calculatorAllowed": false,
      "subParts": []
    },
    {
      "id": "II",
      "name": "Section II: Free Response",
      "type": "FRQ",
      "questionCount": 3,
      "durationMinutes": 60,
      "weightPercent": 33.3,
      "calculatorAllowed": false,
      "subParts": [
        { "id": "II-Long", "name": "Long FRQ", "questionCount": 1, "durationMinutes": 25 },
        { "id": "II-Short", "name": "Short FRQs", "questionCount": 2, "durationMinutes": 35 }
      ]
    }
  ],
  "unitWeights": [
    { "unit": 1, "title": "Basic Economic Concepts", "weightPercent": { "min": 5, "max": 10 } },
    { "unit": 2, "title": "Economic Indicators and the Business Cycle", "weightPercent": { "min": 12, "max": 17 } },
    { "unit": 3, "title": "National Income and Price Determination", "weightPercent": { "min": 17, "max": 27 } },
    { "unit": 4, "title": "Financial Sector", "weightPercent": { "min": 18, "max": 23 } },
    { "unit": 5, "title": "Long-Run Consequences of Stabilization Policies", "weightPercent": { "min": 10, "max": 15 } },
    { "unit": 6, "title": "Open Economy: International Trade and Finance", "weightPercent": { "min": 10, "max": 13 } }
  ],
  "scoringNotes": "MCQ scored by machine. FRQ scored by readers; long FRQ worth 10 points, short FRQs worth 5 points each. Section I is 66.7% and Section II is 33.3% of the total score.",
  "specialPolicies": {
    "calculatorPolicy": "No calculator allowed.",
    "referenceSheet": false,
    "deliveryNotes": "Section I completed digitally via Bluebook app. Section II (FRQ) completed on paper."
  }
}
