{
  "subject": {
    "code": "AP_PHYS_2",
    "name": "AP Physics 2: Algebra-Based",
    "examMode": "HYBRID_DIGITAL"
  },
  "totalDurationMinutes": 180,
  "sections": [
    {
      "id": "I",
      "name": "Section I: Multiple Choice",
      "type": "MCQ",
      "questionCount": 40,
      "durationMinutes": 80,
      "weightPercent": 50,
      "calculatorAllowed": true,
      "subParts": []
    },
    {
      "id": "II",
      "name": "Section II: Free Response",
      "type": "FRQ",
      "questionCount": 4,
      "durationMinutes": 100,
      "weightPercent": 50,
      "calculatorAllowed": true,
      "subParts": [
        { "id": "II-1", "name": "Mathematical Routines", "questionCount": 1, "durationMinutes": 25 },
        { "id": "II-2", "name": "Translation Between Representations", "questionCount": 1, "durationMinutes": 25 },
        { "id": "II-3", "name": "Experimental Design and Analysis", "questionCount": 1, "durationMinutes": 25 },
        { "id": "II-4", "name": "Qualitative/Quantitative Translation", "questionCount": 1, "durationMinutes": 25 }
      ]
    }
  ],
  "unitWeights": [
    { "unit": 1, "title": "Fluids", "weightPercent": { "min": 10, "max": 15 } },
    { "unit": 2, "title": "Thermodynamics", "weightPercent": { "min": 12, "max": 18 } },
    { "unit": 3, "title": "Electric Force, Field, and Potential", "weightPercent": { "min": 12, "max": 18 } },
    { "unit": 4, "title": "Electric Circuits", "weightPercent": { "min": 10, "max": 15 } },
    { "unit": 5, "title": "Magnetism and Electromagnetic Induction", "weightPercent": { "min": 10, "max": 15 } },
    { "unit": 6, "title": "Geometric and Physical Optics", "weightPercent": { "min": 12, "max": 18 } },
    { "unit": 7, "title": "Quantum, Atomic, and Nuclear Physics", "weightPercent": { "min": 10, "max": 15 } }
  ],
  "scoringNotes": "MCQ scored by machine. FRQ scored by readers; each question worth 12 points. Section I is 50% and Section II is 50% of the total score.",
  "specialPolicies": {
    "calculatorPolicy": "Four-function, scientific, or graphing calculator allowed on both sections.",
    "referenceSheet": true,
    "deliveryNotes": "Section I completed digitally via Bluebook app. Section II (FRQ) completed on paper. An equation sheet and table of constants are provided."
  }
}
